topic,Agent-A,Agent-B
"1. ""Safety and Accident Rates"":","Although the immediate returns on investing resources into the practice of two-stage left turns may not appear significant compared to other measures, the long-term benefits of adopting these globally recognized safety maneuvers could lead to substantial improvements in motorcyclist safety.","Though long-term benefits of two-stage left turns may exist, we need to critically question whether the investment of time, effort, and resources to practice this complex maneuver could be better utilized against more universally accepted safety measures."
"2. ""Psychological and Behavioral Impact"":","The complexity of two-stage left turns indeed poses a challenge, but this also provides an opportunity to equip riders with a broader skill set through comprehensive education, thereby addressing a wider array of traffic scenarios.","Granting the variety in rider behavior, we should consider if adding a potentially confusing element to an already significant skillset might serve more as a distraction than as a safety enhancement. Comprehensive rider education should be easily digestible and pragmatic."
"3. ""Legal Framework and Global Practices"":","Despite the resource requirements, conducting local research to implement proven global measures like two-stage turns is a worthwhile investment. This would be a moderate step towards a more unified, safer biking environment worldwide.",it remains essential to question the feasibility and prudence of universally implementing a singular traffic maneuver given vast disparities in traffic norms and behaviors globally. Localized research is indeed valuable but should aid in identifying region-specific solutions rather than imposing a global one-size-fits-all solution.
"4. ""Educational Requirements"":","While the introduction of two-stage left turns implies an augmentation in training processes, it aligns with the constant evolution of road safety measures. Potential short-term challenges are overshadowed by the long-term implications for safety improvement.","The constant evolution of road safety measures should ideally make procedures simpler, more intuitive rather than more complex. Hence, an additional, complex maneuver like two-stage left turns might not be the best progression strategy in enhancing motorcycle safety."
"5. ""Future Outlook and Infrastructure"":","Emphasizing technologically advanced infrastructure improvements with a focus on specific maneuvers like two-stage left turns does not restrict broader developments. Instead, it allows for safer, more efficient future transport systems whilst fostering innovative solutions for universally recognized traffic safety issues.","While appreciating the role of technology in fostering safer environments, focusing innovative efforts on a specific, debatable maneuver like two-stage left turns could potentially detract from solving universally acknowledged traffic safety issues."
conslusion,"Thus, considering the potential for increased safety, adaptation to diverse traffic situations, encouragement for local studies, education enhancements, and forward-thinking technological adaptations, the implementation of two-stage left turns for motorcycles is recommended.""","Thus, while recognizing potential areas where two-stage left turns could prove beneficial, the overall cost, required adaptation, potential confusion it could introduce, and the question of wide-scale effectiveness suggest a need for more definitive evidence before sizable resource allocation and widespread adoption."""